Comment ID,Body,Author,Created Date,Score,Parent ID,Submission ID
nlmj31i,"1. Creepcast with Wendigoon and Meatcanyon///2. Watcher - Are You Scared?///I like Watcher more than Creepcast because the episodes are bite size, but I'm still iffy about them because of that shit they pulled last year 😅","wondrous_sidekick",2025-10-27,1,t3_1oh5jlv,1oh5jlv
nlljs4m,"This may sound silly, but a standard, good food processor! I can dice and julienne well with a chef knife, but using a food processor is so much faster and easier. Grating cheese, mixing dough, chopping veggies, making potato chips or fries, it’s just so much easier. (Runner ups would be baking/ cooling racks, a great cutting board and chef knife combo, stainless steel sauté pans, good stainless tongs.)","jpinakron",2025-10-27,14,t3_1oh4um5,1oh4um5
nln2773,"On the expensive end (my cheap picks are already on the list):   18"" chamber vacuum sealer.   Being able to seal liquid-heavy items (marinating meats for example) is huge, not to mention being able to seal things like whole briskets, racks of ribs, etc.   When I run my offset smoker now I always throw extra stuff on just to vac seal and freeze for later.","Draskuul",2025-10-27,2,t3_1oh4um5,1oh4um5
nls4cat,"My favorite is my ThermoWorks Thermapen instant read thermometer - besides meats, I check temp for cakes and bread, etc. Also I use my scale all the time. I do metric measurements, so it is great.","BrenInVA",2025-10-28,1,t3_1oh4um5,1oh4um5
nlsr6gf,"Make a Battelman Cake (stale leftover bread pudding cake)//2 eggs//3 tablespoons of breadcrumbs//20 g of butter//160 g of cherries//1 teaspoon of cinnamon//50 g of ground almonds//250 ml of milk//75 g of powdered sugar//1 bag of vanilla sugar//250 g of stale milk loaf or leftover buns, brioche bread, etc.////Preparation: 15min//Cooking: 1 hour//1 Crumble the bread into small pieces and bring the milk to a boil. Pour the hot milk over the bread and crush with a fork. Add the sugars, almond powder and cinnamon and eggs one by one. Mix well.//2 Add the cherries to the mix and then pour everything into a buttered dish.//3 Sprinkle with breadcrumbs and sprinkle the butter into pieces. Cook at 210°C for 1 hour.","purgruv",2025-10-28,1,t3_1oh3g26,1oh3g26
nlo0a24,"You can put anything in there - leftover veggies, cheese, maybe some ham. Season with herbs, salt, pepper and bake. It freezes well and heats up nicely in a microwave.","OldsterHippie",2025-10-27,1,t1_nllfu5a,1oh3g26
nll8iid,"I definitely found the technique online. I've made the pull apart a bunch but stumbled on this today.//Homemade Cheese Bread - Extra Soft - Sally's Baking https://share.google/jrpad1BujL1eayiyW","DewersHopScotch",2025-10-27,1,t1_nll7nno,1oh347q
nllfehb,"Might be too lean, depending on the leg and how it has been trimmed. The small ones tend to be lean. Legs can have a lot of silverskin and sinew relative to the amount of meat.","kbrosnan",2025-10-27,7,t3_1oh2j38,1oh2j38
nllth1g,"Thanks.  Okay, so small, medium or large grind?  Once or twice through (I have a meat grinder, and do 30lbs of beef every spring for 80 6oz burgers for the freezer)?","PierreDucot",2025-10-27,1,t1_nlldh0t,1oh2j38
nlnfoia,"Thanks for answering the question with your first-hand experience.  I want to use it for homemade gyro meat, and your response makes me feel like it would work.  Did you do a large, medium or small grind?","PierreDucot",2025-10-27,1,t1_nlmub8m,1oh2j38
nlls7ik,"The meat and all the grinder should be very cold. Cut the meat into grindable sized chunks and put into the freezer until half frozen. If you regrind, put the first pass back in the freezer and half freeze again before the 2nd run.","BadManor",2025-10-27,5,t1_nll6hki,1oh2j38
nlp1x2k,"Twice through fine grind using a Kitchen Aid meat grinder attachment.","Own_Win_6762",2025-10-27,1,t1_nllth1g,1oh2j38
nlqn67f,"Not at my Costco, sadly. But I can buy Grillo's pickles west of the Rockies and they're the ONLY pickles in my fridge now. Everything else is just limp cucumbers in vinegar.","Upset-Line-9389",2025-10-27,1,t3_1oh1stb,1oh1stb
nljmzkn,"I'm having a hard time deciding how I would use this. Maybe a grilled cheese sandwich/panini type deal. ","sargon_of_the_rad",2025-10-26,1,t3_1ogw5wa,1ogw5wa
nlslb45,"I bought the multipack on sale once. I really liked the mustard one which also had pickles in it and would go for that one over the pickle one.","Aggressive_Start_",2025-10-28,1,t3_1ogw5wa,1ogw5wa
nljllt3,"I love pickles with stems.","SubstantialPressure3",2025-10-26,1,t3_1ogvrok,1ogvrok
nlitent,"https://www.kingarthurbaking.com/recipes/chocolate-babka-buns-recipe","plantainpizza",2025-10-26,122,t3_1ogso7q,1ogso7q
nlml691,"I recognised these right away! They were one of the best buns I've ever made.","Happy-Demand2607",2025-10-27,3,t3_1ogso7q,1ogso7q
nlipv8w,"Too much cheese concentrated in one area; so when the loaf is baking all of the moisture from the cheese creates a pocket. //Try adjusting how you are incorporating the cheese into the load and it should be more consistent.//Edit: meant loaf not load lol","Haecceitic",2025-10-26,3,t3_1ogs32g,1ogs32g
nlkci5z,"Heck ya, looks great. I made some last week with some cream cheese icing and it was amazing. I think I’ll make it again tomorrow. 🤤","Dependent_Stop_3121",2025-10-26,2,t3_1ogq97q,1ogq97q
nlibco2,"Tbf this is the PICKLE subreddit so I feel like every thread slandering any pickle that isn't just a basic pickle kind of sucks.  All pickles are good pickles! Whether you're personally into it or not don't come after people that do. This should only be a place of pickle love :D.","azul360",2025-10-26,41,t3_1ogokq7,1ogokq7
nlhwjpc,"So, can I have your pickles?","valhallaswyrdo",2025-10-26,25,t3_1ogokq7,1ogokq7
nlhxrm8,"I love bread and butter pickles on burgers and sandwiches. I don’t even fit in on the pickle subreddit :(","v1br4nt",2025-10-26,28,t3_1ogokq7,1ogokq7
nlifudb,"B&B pickles have no business on a hamburger. Ever.","Ok_Orchid1004",2025-10-26,5,t3_1ogokq7,1ogokq7
nlhw453,"Why are you bigoted towards other pickles?","DrFeelOnlyAdequate",2025-10-26,13,t3_1ogokq7,1ogokq7
nlr8jk0,"Are you me? This literally happened to me yesterday. It was my first time trying that restaurant but it left me wondering what restaurant chooses to use bread and butter pickles instead of dill chips? And why?","EpicSaberCat7771",2025-10-28,2,t3_1ogokq7,1ogokq7
nlijsft,"I have to have bread and butter pickles on my burger. I'm disappointed with regular dill. I'm surprised that people don't like them.","Upset_Painter_3812",2025-10-26,2,t3_1ogokq7,1ogokq7
nli2n14,"When I was a young lad I tasted the bread and butter pickles at Nan’s and from that day forward, I made a swear to myself to never touch these “pickles” again","buttmaster100",2025-10-26,2,t3_1ogokq7,1ogokq7
nlia1i6,"Those are my favorite kind of pickles 😭","noiness420",2025-10-26,0,t3_1ogokq7,1ogokq7
nlja4g7,"sweet and savory can work, but it's so few and far between i find it baffling how many people insist on making everything they consume sweetened... like this recent rage with candied meat, wtf is wrong with everyone.","lesenfantoublies",2025-10-26,1,t3_1ogokq7,1ogokq7
nljbbaz,"I like both kinds. Even put both kinds on (different) burgers. But you gotta prepare somebody for the sweet pickles","JWarblerMadman",2025-10-26,1,t3_1ogokq7,1ogokq7
nljrwu8,"I love bread and butter pickles. I will defeat you in combat.","opaul11",2025-10-26,1,t3_1ogokq7,1ogokq7
nljz2ie,"I hate bread n butter and fermented pickles. I like run of the mill hot pickle, dill pickle. They just hit different. What a sin!","Powerful-Pea8970",2025-10-26,1,t3_1ogokq7,1ogokq7
nlk0k3w,"Shits evil man. I walk in to walmart just now & shelves of shelves of bread & butter pickles outnumber the regular ones. smh i couldnt find the vlasic crunchy ovals like i had got at one of their other stores near me","theapeartist",2025-10-26,1,t3_1ogokq7,1ogokq7
nlkjdji,"I remember on Mother’s Day I took my mom to a local restaurant people said was great and I ordered a pastrami with pickles and mustard//First off they put in on a soft French bread bun but from a grocery store , they proceeded to to take what was without a doubt deli meat and fry it in a pan to the point it was shredding and dry//I got my mustard and pickles but these asshole toasted and buttered the shit out of my bread and I was like sooo thrown off, took a bite and was like wtf is this lol//I made them take it back, and she was like I can get you something else…. I literally just said no I’m good.//That’s one mistake you’re not allowed to make lol","Deep-Ad-2784",2025-10-27,1,t3_1ogokq7,1ogokq7
nlm5cym,"you don’t like bread n budda pickles???  oh dear me.","mademoisellemayhem",2025-10-27,1,t3_1ogokq7,1ogokq7
nlo417r,"I love all pickles except for those. Pickles shouldn't be sweet","ChaoGardenChaos",2025-10-27,1,t3_1ogokq7,1ogokq7
nlotbld,"I. Hate. Bread. And. Butter. Pickles. //I would have demanded my money back lol","Slight_Knight",2025-10-27,1,t3_1ogokq7,1ogokq7
nlq0uf8,"I’ll eat a whole jar of bread and butter pickles. You know this is the pickle sub yeah?","Cold_Tower_2215",2025-10-27,1,t3_1ogokq7,1ogokq7
nlu73tu,"This is simply the wrong place at the wrong time. I think being big pickles are great, but I would not like them on my burger. I can absolutely see why you are traumatized. I hope you told them about their slutty burgers","DueProgress7671",2025-10-28,1,t3_1ogokq7,1ogokq7
nliamj5,"I love B'n'B's on a burger. We made 'em at the restaraunt I worked at years ago - like, 20-30lbs of cukes at a time. Simple quick-pickles with white vinegar, white sugar, peppercorns, mustard seed, coriander, salt, water. //We had people ask for extra pickles pretty often, so we just gave 'em entire handfuls in a bowl and went, ""Yeah, go for it. We've got like, many gallons of these.""","anothersip",2025-10-26,1,t3_1ogokq7,1ogokq7
nlmyzu5,"bread and butter pickles on a burger is highly irregular, though. a menu should specify that it’s going to be a sweet pickle on a burger, because 99 times out of 100 a pickle on a burger is hamburger dill","elanhilation",2025-10-27,2,t1_nlibco2,1ogokq7
nlri14h,"They are all good pickles bront","incrediblystiff",2025-10-28,1,t1_nlibco2,1ogokq7
nli2b6r,"Only in this instance! I'm usually the pickle thief. To make it even better, I of course had ordered extra pickles....","isthatsoreddit",2025-10-26,13,t1_nlhwjpc,1ogokq7
nli4hpn,"This is not a true pickle sub if people don’t love all varieties of pickles. I’m shaking my head at all of the posers here.","ColoradoWeasel",2025-10-26,21,t1_nlhxrm8,1ogokq7
nli4n4i,"Me too! I like all pickles. But sometimes a bread and butter pickle fits really well with a sandwich. Especially cold cuts with butter instead of mayonnaise","Shot-Statistician-89",2025-10-26,8,t1_nlhxrm8,1ogokq7
nliaqry,"Yeah honestly this sub gets old.  I love all kinds of pickles (other than extremely hot because my body hates me) so it feels weird how the PICKLE sub is like ""you can only like generic pickles and literally nothing else"".  We need like a r/truepicklefans or something for people like us that actually like all pickles XD","azul360",2025-10-26,4,t1_nlhxrm8,1ogokq7
nlhyqvu,"Same bread and butter pickles on burgers are amazing.","EvenIf-SheFalls",2025-10-26,7,t1_nlhxrm8,1ogokq7
nlilsqy,"I could put mayo, ketchup, tomato, onion, lettuce, and bread & butter pickles on a bun and never miss the burger patty.","Upset_Painter_3812",2025-10-26,2,t1_nlifudb,1ogokq7
nlm3osb,"Your opinion, there Sport!  I love my Spicy B& B pickles on my bacon mushroom cheesburger WITH candied Jalapeños.","Old_Explorer_4553",2025-10-27,1,t1_nlifudb,1ogokq7
nli3biz,"For real! I went back and looked at the menu,  and there was ZERO mention of bnb. Juat said pickles. The rat bastards","isthatsoreddit",2025-10-26,2,t1_nlhzor2,1ogokq7
nlij1i9,"And need nmto say nothing more than ""bread n butter pickles on my burger""  I feel like there would be pitchforks and torches","isthatsoreddit",2025-10-26,3,t1_nli6fss,1ogokq7
nlm43kh,"That would make so many people sad!  Especially ME!  I deserve the right to put Spicey B& B pickles on my hamburger if I WANT!","Old_Explorer_4553",2025-10-27,1,t1_nligw1k,1ogokq7
nlimu3x,"And I think part of the problem was being completely blindsided.  The description  only said ""pickles"". And let's be honest,  most people aren't putting anything but dill on a burger so they should definitely have specified bnb.  Because,  all joking aside, it was a great burger.","isthatsoreddit",2025-10-26,2,t1_nlijsft,1ogokq7
nli71zr,"They’re the reason I’m a little nervous every team I eat and/or buy pickles. It’s a trick.","honestlykindofmagic",2025-10-26,2,t1_nli2n14,1ogokq7
nln5iyf,"I also like sweet and savory. On some things, lol. Sweet pickles and burgers aren't it, imo. //And. Ew. Candied meat. Why?","isthatsoreddit",2025-10-27,1,t1_nlja4g7,1ogokq7
nliknpv,"Lol I asked for extra not knowing they'd be sweet!//My nephew, is fortunately for him, my favorite thing in the entire universe. And I say 'fortunately  for him"" because the only pickle he likes is bread n butter and if I didn't love him so much I'd  just have to cut my losses. Poor misguided soul.//Lol seriously though, I love making fridge pickles and I'm contemplating making him some. But I've never made bnb so I  haven't  yet because I'm not 100% sure about them. And I don't wat them very often to know how they should look/taste being homemade.  I guess i could make some, taste them an see if i nearly throw up to judge if they're right.","isthatsoreddit",2025-10-26,3,t1_nliamj5,1ogokq7
nlnyd2f,"You do realize it was an obvious joke? Like obviously it's a joke because one is not calling cops over pickles //Unless you take my pickles. Then you're catching hands.//The issue was there was no indication that I should be expecting a bread n butter on a burger. Most people  would never put anything  but a dill pickle on a burger. Plus, this sub loves to tease about bread n butter pickles.  So I was sharing my weird experience in a humorous manner.","isthatsoreddit",2025-10-27,1,t1_nlleo8q,1ogokq7
nlibr52,"I recently tried some homemade spicy b&b pickles at a cheese party and they were so insanely good. But, they are so flavorful they need to be eaten on their own. Definitely do not belong on a burger!","fakesaucisse",2025-10-26,8,t1_nli2rgr,1ogokq7
nlk1hyy,"I dunno, I got some of the Famous Dave's Devil's Spit pickles and have never been so disappointed in my life. Sure they had some heat but the sweetness absolutely killed it for me.","TheWillyWonkaofWeed",2025-10-26,1,t1_nli2rgr,1ogokq7
nlin05g,"A lot of this sub does have that problem yeah XD.  I don't mean offense but it's crazy how elitist the sub that is supposed to be all about the love of pickles actually is.  The world sucks enough.  Whether you're a fan or not just spread the pickle love we all need in these times.  Pickles make the world go round :D.","azul360",2025-10-26,4,t1_nlil62e,1ogokq7
nlm34ui,"Yes they do!  Especially the hot and spicy ones! I don’t like dill , never have!  Give me my spicey Bread & Butter pickles , with candied jalapeño peppers , pleeze!","Old_Explorer_4553",2025-10-27,1,t1_nljz4xj,1ogokq7
nltcfoc,"Hell yes! See pickles bring us all together! <3  Hope you have a great day!","azul360",2025-10-28,1,t1_nlt7ih2,1ogokq7
nlmzg5g,"i can envision a burger with bread and butter that’s good, but i wouldn’t put exactly the same toppings on it as i would a burger with dill. definitely would skip the ketchup, maybe add a dab of mustard, probably go with caramelized onions instead of raw. it’d be a whole different thing, dill and sweet pickles aren’t a one for one replacement","elanhilation",2025-10-27,1,t1_nlm3cx5,1ogokq7
nli5s6l,"There should be two subs. Pickles and pickletoddlers.","ColoradoWeasel",2025-10-26,7,t1_nli4hpn,1ogokq7
nli6ag5,"That's like saying r/sushi is illegitimate unless everyone there likes cream cheese rolls. Or that r/pizza needs to have everyone like pineapple. //Nothing wrong with liking the sweet outlier, but that doesn't mean everyone else's appreciation is disqualified","SuperSecretMoonBase",2025-10-26,2,t1_nli4hpn,1ogokq7
nli3h7a,"Comped meal and a year of free non-candied pickles and you're even.","Mr_Gray",2025-10-26,2,t1_nli32gv,1ogokq7
nlhza5j,"Why cant pickles be a dessert?","DrFeelOnlyAdequate",2025-10-26,10,t1_nlhyjkx,1ogokq7
nlk1eu8,"See, if I had bitten into that burger, I'd be happy. I'd think to myself, ""Bread and butter pickles. Yum. Classy pickle upgrade!"" I understand where you're coming from. I personally hate dill pickles on chicken sandwiches. Even if they are removed, the dill pickle juice has absorbed into the bun. I'm not one to eat bnb pickles straight out of jar. I only eat them on hamburgers when my husband grills.","Upset_Painter_3812",2025-10-26,1,t1_nlimu3x,1ogokq7
nluo0jd,"Aha well there are probably plenty of posts about pickles there also","Cold_Tower_2215",2025-10-28,1,t1_nlq5zut,1ogokq7
nlj8sje,"For sure! Yeah, I mean - if you make a quick-pickle brine (use hot/extra-warm water/vinegar), then you'll be able to tell pretty quickly if you like 'em. Like, a few pickling cucumbers to dump the brine over, your mandoline/knife, jar, saucepan, and your brine ingredients/spices is all it takes.//Especially when your brine is heating up and the spices are infusing with the vinegar brine. It's extra-strong in the air, and it's absolutely magical (if you're into that, of course) - I love it.//Of course, you could leave the sugar out. Or cut the amount of sugar by 3/4's - I don't like mine too super sweet, but I like some amount of sweetness for a BnB batch. They go really well with a charcuterie plate/board, especially with extra-salty cheeses or cured meats. The bit of sweetness acts almost how a good preserves would, served with the rest of the board. Complementary 'n such. //But yeah, it's not for everyone :P","anothersip",2025-10-26,1,t1_nliknpv,1ogokq7
nlio8fo,"The world just needs more pickles. Pickles = love","isthatsoreddit",2025-10-26,14,t1_nlin05g,1ogokq7
nliuzqm,"I have that problem.  I'd never call anyone out on their choice in pickles.  But, as far as I'm concerned, if it isn't a form of dill, it isn't for me.","bpleshek",2025-10-26,11,t1_nlin05g,1ogokq7
nli35ro,"No, but I will happily take any leftover pickles. 😁","EvenIf-SheFalls",2025-10-26,7,t1_nli2zao,1ogokq7
nlog9c6,"Calling the cops, declaring trauma, over pickles, plus all the various comments and replies on this post wasnt clearly a joke?? How?? //And idk how can explain any clearer that the source of the joke was me getting bread n butter pickles on a burger instead of dill. Because it's  a generally accepted practice to put only dill pickles on a burger .   I ....I'm  genuinely not sure if you're juat trolling me right now or if you truly think  someone is actually crying  trauma over fricking pickles.//I'm going with it just has to be trolling. Stay briney friend","isthatsoreddit",2025-10-27,0,t1_nlo94tc,1ogokq7
nlnq1q7,"Bread and butter pickles are an abomination.","Tasty_Clue2802",2025-10-27,3,t1_nliuzqm,1ogokq7
nlihoby,"Putting a bread and butter pickles on a burger and with no indication (because  hello, who does that) is INDEED  a crime!! *stomps off hugging a jar of proper DILL pickles and muttering about kids on the lawn*","isthatsoreddit",2025-10-26,4,t1_nlidj80,1ogokq7
nlii41v,"I think, if we're getting technical, this is jokes about personal taste. It's hyperbole. Nobody here thinks they're genuinely a war crime.//I get it though. That's how I feel about the apparent jokes about melts on r/grilled cheese. Being on the other end of things makes it hard to tell, sometimes","SuperSecretMoonBase",2025-10-26,1,t1_nli6z5z,1ogokq7
nlihxec,"Lol just in the last couple of years I started liking spicy bnb. But sweet pickles only if they're also spicy.","isthatsoreddit",2025-10-26,4,t1_nli35ro,1ogokq7
nlm3wem,"Oh contraire!  It’s the best ever ! I love my Spivey B&B pickles on my bacon cheeseburger with mushrooms, lettuce , tomato , and spicey sweet Jalapinos!","Old_Explorer_4553",2025-10-27,1,t1_nlin1bx,1ogokq7
nlo8anv,"That's so awesome. I love that you have some great memories around that. I guess canning and such is just how things were done back in the day for lotsa' folks... My family included. My great-aunt and great-uncle would make huge batches of jams/preserves and give a bunch away as gifts to friends. I guess it went from necessity to novelty throughout the decades, 'cause they were totally fine on money but still saved every dime and even all the fruit/veggie scraps went from the kitchen to the donkeys.//My favorite was when they jarred up pickled okra - they'd pick up a half-bushel from the farmer's market and make a big ol' pot of brine. I remember being sent to the basement to bring up the jars and salt boxes, and then helping scrub all this okra in the sink while standing on a stool so I could reach the faucet, haha. I love all pickled things, so those were some of my favorite days: *Truly unlimited pickles, fresh veggies from the farmer's market and home-made. Aw yissss.*//And when it was peach season, oh my god. The best, fresh peaches. Yellow peaches and white freestones with every meal. Like candy.","anothersip",2025-10-27,1,t1_nln4zqk,1ogokq7
nlohn5q,"I don’t know - I still don’t get what’s the issue here? You don’t like pickles?//I don’t troll people, so let me clear that part up, but you’re getting defensive because I’m missing the joke. I get you’re joking now, but from the post I didn’t understand what the actual problem was.","Leather-Heart",2025-10-27,0,t1_nlog9c6,1ogokq7
nlnx3xu,"I mean, other than teasing, we are? Lots of people actually  like bnb and we're not kicking them out, lol.  I also see people give each other a hard time over liking vinegar pickles over fermented and vice versa. It's  reddit, sarcasm is currency.","isthatsoreddit",2025-10-27,4,t1_nljdcmp,1ogokq7
nlevgjx,"Haha! Synonymon buns, nice!","FaithKneaded",2025-10-26,8,t3_1og8t48,1og8t48
nlemah7,"Maybe you can just divide your favorite regular sized bread loaf recipe into quarters.  ////Or do what I do:  I make a bunch of dough for 12"" pizza crusts and freeze them. Then I use a batch of that dough to make 2 (a bit large) burger buns.","Red-Leader-001",2025-10-26,2,t3_1og7dag,1og7dag
nljv78o,"# Buns, Burger//Makes 2 buns//Ingredients:  /1/4 c warm water (too hot will kill the yeast, too cool will not let the yeast grow)  /1/2 tsp yeast  /1 tbs sugar  /1 1/2 tsp butter  /1/2 egg (about 2 tbsp of beaten egg)  /3/4 c bread flour  /1/4 tsp salt//Directions: 350\*//1. In a mixing bowl, add ingredients with salt last. Water should be lukewarm, too hot will kill the yeast, too cold will not activate the yeast./2. Mix with a dough hook or by hand until smooth. You may have to add a tidge of water or flour (could be up to a 1/4 cup), depending on the humidity, to make it nice and smooth./3. Spray the top of the dough with cooking spray (lightly) and cover the bowl with a damp cloth. Let rise until doubled in size (about 1 to 2 hours) or in a bag in the refrigerator overnight./4. Form into 2-3 rolls and let rise until almost doubled in size./5. Brush with melted butter and sprinkle with seeds of your choice.//Bake rolls - 15 - 18 min. Then brush with more melted butter.","TheNordicFairy",2025-10-26,2,t3_1og7dag,1og7dag
nli8q6l,"Yeah, I think you'd DEFINITELY profit from the opinion of an expert such as I am. Yes, please DM me and I'll tell you where to ship them overnight. Please make sure that two remain as they are, two have a cream caramel glaze, and two have a cream cheese frosting. That way, I can scarf them down, I meant, judge them well...","ajqiz123",2025-10-26,2,t3_1og73k2,1og73k2
nlh69ud,"I don’t hate frosting. I love a good cream cheese or apple cider vinegar buttercream frosting. But most of the time it’s applied too thick and it’s too sickly sweet to do anything other than detract from the lovely spices. A sugar glaze would be nice though.","AotKT",2025-10-26,3,t1_nlellrc,1og73k2
nlf7d9c,"When you make your own you can make it amazing. Cream cheese, a little butter, vanilla and juuuust enough powder sugar to make it into icing","eatpraymunt",2025-10-26,36,t1_nlenv44,1og73k2
nlemckd,"Always grate your own cheese","jibaro1953",2025-10-26,1,t3_1og3pn1,1og3pn1
nlfgzyq,"It is! Mixed berries jam. My gf introduced me to it, granted she doesn’t eat cheese but she introduced me to jam with bread and ever since I kinda went overboard with it. I love her so much","Davidthebread",2025-10-26,1,t1_nlddjb7,1ofzsl6
nlkf8xq,"They are super good, I used to think they were just expensive but normal pickles in a bag. Once I tried them, I was hooked! I like to get them as treats on road trips lol","raerabbit27",2025-10-27,1,t3_1ofwldm,1ofwldm
nlk6ztz,"OP, I’ve made a halloumi crumble with pepitas.//We take crumbled cheese (do the hanging thing at the top of this thread to get yours extra dry and crumbly), spices, pepitas, and a little neutral oil in a non-stick pan on low-medium heat and let it go until it’s crackling, then we flip it, let it go until browned and break it up. You need to add fat to the pan because chèvre is pretty low fat as far as cheeses go.","YoullBruiseTheEggs",2025-10-26,1,t1_nlbsnrl,1ofuunz
nlfi4n2,"*sigh* I want to go somewhere just to buy a bucket of pickles.","Abandonedstate",2025-10-26,1,t3_1ofcxll,1ofcxll
nli4hfi,"Apparently they also make bread and butter pickles now as well!","PrincessLinked",2025-10-26,1,t1_nl84qx3,1ofcxll
nlw6nyf,"Thats just the pickles, a sandwich is over $20.","SolidSnek1998",2025-10-28,1,t1_nlw2upg,1ofcxll
