Comment ID,Body,Author,Created Date,Score,Parent ID,Submission ID
nlhhdfg,"I hope this doesn't seem rude, but I'm very much learning how to make different breads, buns, rolls, etc., but are the rolls supposed to look as dense as they do? Should they have had a little longer cooking? Or, is the inside what they should look like?","Fluid_Cauliflower237",2025-10-26,1,t3_1of9rnu,1of9rnu
nlh8r5i,"I mix my dry seasonings into the flour first, so sorry about that! If I have add ins like cheese or jalapeno or cranberry/walnut I add those in during shaping. /If you make it, report back, I would love to see!!!","animalsweedandcoffee",2025-10-26,2,t1_nlcp6ui,1of9rnu
nlfrz4r,"I want a big ol bag of these and some cheese dip!","deep-fucking-legend",2025-10-26,1,t3_1of7m5h,1of7m5h
nlemxmw,"It makes me miss the days where I worked in this little mom and pop shop Italian deli and the pickles came in large 5 gallon buckets.  When we used all the pickles, we dumped the juice.  Thinking back to that makes me want to cry now…what fools we were!","dezie1224",2025-10-26,2,t3_1of3ewt,1of3ewt
nlipr3j,"If he would retain the pickle juice when all the pickles were sold. I bought a pickle (as one does) and noticed he was down to the last three so I asked. He kindly pulled the pickles and gave it to me.","edwardothegreatest",2025-10-26,1,t1_nlf3j3e,1of3ewt
nleoegz,"Omg I wish I tried to make cheese sauce with this and it was a fail. Made a honey mustard sauce instead.","mongoosai",2025-10-26,1,t1_nl9law4,1oefrwl
nlf63k9,"I’ve heard sodium citrate is the secret ingredient to making commercial-style cheese sauce","ajdudhebsk",2025-10-26,2,t1_nleoegz,1oefrwl
nljqvel,"Lost 50 pounds eating a shitton of pickles","Konilos",2025-10-26,2,t1_nl49dcy,1ods1em
nlgeras,"What? No cheese?","EveryValuable1503",2025-10-26,1,t3_1odlowg,1odlowg
nlgsg66,"I didnt have cheese in my fridge ","ConferenceNo8396",2025-10-26,1,t1_nlgeras,1odlowg
nlhusq6,"Ya my son and I both tried it cuz he LOVES pickles. We both hated it","R2-D2savestheday",2025-10-26,2,t3_1odfly8,1odfly8
