Comment ID,Body,Author,Created Date,Score,Parent ID,Submission ID
nlxa807,"These are easily the best pickles around in Ontario. The full sour dills and hot and spicy and incredible. Even the hot, sweet, and spicy chips are killer","FridgeFucker17982",2025-10-29,1,t3_1oip2sr,1oip2sr
nlx1n4h,"Right?? It was my favorite with Oven Roasted Chicken (another sunset item 😭). //The best part is it’s a pretty neutral flavored bread, so you can top however you want! Sesame seeds are my favorite, but I also love zaatar and herbes de Provence","jjrandall",2025-10-28,2,t1_nlx17ax,1oiorez
nlwo04r,"The problem is porkbutt is a cut of meat that is best slow roasted to give the connective tissue time to break down","juliacar",2025-10-28,19,t3_1oin1jr,1oin1jr
nlwpwlr,"I need a grilled cheese with that STAT","darkeststar",2025-10-28,2,t3_1oimo91,1oimo91
nlwv81i,"The buns!!! They look great","Visible_Photograph86",2025-10-28,1,t3_1oil9n8,1oil9n8
nlx54ze,"Let them know that you have put poison in one of the buns. It’ll be like Russian roulette.","SoMuchEpic95",2025-10-28,1,t3_1oil9n8,1oil9n8
nlw2kd8,"I have been getting big tubs of BestMaid pickles. Sour and Dill are both really good. You can order them off Amazon if you don't have them locally. I have been getting them from Amazon for years.//If you haven't had a sour pickle before, they are very similar to dill but more intense. When I grew up in Florida I used to eat them ll the time not knowing what they were. If you saw a huge glass jar with a bunch of pickles at a gas station or deli, they were probably sour pickles. When I moved west, I kept trying different dill pickles but couldnt find one that punched me in the face like I used to get in Florida. Someone recomended sour pickles and it was like magic after my first bite.","alttabbins",2025-10-28,2,t3_1oika4j,1oika4j
nlw4qhb,"You can order Disneyland pickles here: [https://delivery.gfsstore.com/store/gfs/products/35442727-deli-pickles](https://delivery.gfsstore.com/store/gfs/products/35442727-deli-pickles)","bindersfull-ofwomen",2025-10-28,2,t3_1oika4j,1oika4j
nlwes76,"You can see if you can find them with reasonable delivery. Also I'm in the South, lived in NYC, and in BOTH places so pickles are never refrigerated. It just sits on the counter. I just wanted to give you the name because I've seen it here often.","bindersfull-ofwomen",2025-10-28,2,t1_nlwe1rd,1oika4j
nlwgl5y,"Kelp pickles were a Tiktok trend maybe 2 years ago. I hope it's the original creators of it, but I aint looking up all that.","bindersfull-ofwomen",2025-10-28,1,t3_1oiiv4j,1oiiv4j
nlvjl1j,"After you chill and lift off the fat-cap, that is pretty much rendered fat//You do want to make sure there is no stock hanging off of it. You then can melt and strain with cheese cloth to make sure it is free from solids. Heat it once more to make sure to drive the water out of it, so you are left with a pure fat.","Ok-Butterscotch2321",2025-10-28,1,t3_1oihtp9,1oihtp9
nlvk46c,"I guess my worry is the gelatin. There was a lot of gelatin mixed in with the fat I collected, I worry the cheesecloth won't capture it because it just liquifies once it's heated up again","rainbow-lapis",2025-10-28,2,t1_nlvjl1j,1oihtp9
nlvnp63,"I made one this weekend and it goes well with cheese but my guess would be marmelade or chocolate would be better.","Thecatstoppedateboli",2025-10-28,2,t1_nlvhmaw,1oifws0
nlurchc,"When i get a lemonade from wherever, I have them put pickles in it","isthatsoreddit",2025-10-28,2,t3_1oidc8d,1oidc8d
nluk91l,"Looks absolutely unreal, now I'm craving cheese at 2am thanks a lot","kindlyinterval5",2025-10-28,1,t1_nlu9xnu,1oi9euw
nlvsduk,"I love their Dijon mustard. I didn’t know they sold pickles too","CombatWombat1973",2025-10-28,2,t3_1oi3l2y,1oi3l2y
nlsn7fh,"Seems difficult in the UK now to get gherkins/cornichons without sugar. Paid £7.50 for these at a cheese shop!","Tasty_Event_7721",2025-10-28,1,t3_1oi3l2y,1oi3l2y
nltblsc,"... and cheese is just milk and salt.//Your starter is ingredient #4.","hirsutesuit",2025-10-28,-2,t1_nlrthn7,1ohyqey
nltgdfb,"Except for the fact that milk won’t become cheese without an additive like rennet. Starter is nothing but flour and water to begin with, so in terms of additive ingredients, i still say it’s only 3","PaceEBene84",2025-10-28,4,t1_nltblsc,1ohyqey
nlrnmuc,"I just googled Claussen deli style. They looks almost exactly like the ones in the glass jar, just bigger and with deli style on the packaging. They look like the same pickles.","Taranchulla",2025-10-28,1,t1_nlriawj,1ohx99s
nlr9jn1,"Man Detroit style is so underrated, that crispy cheese crust hits different than any other pizza style","Hot-Championship5958",2025-10-28,12,t3_1ohx8eq,1ohx8eq
nlrv6hg,"I haven't had it but it looks so good  because of that cheese that I'd eat it. I'm not a pizza fan. If I like a pizza, that's kind of a big deal.","Purple_Woodpecker799",2025-10-28,-2,t1_nlr9jn1,1ohx8eq
nlwi0ml,"Both, the pepperoni was under the cheese. Not sure why I did it that way.","ItsCheesyGood",2025-10-28,1,t1_nltbc4h,1ohx8eq
nlr9mua,"Lmao avatar day cookies, that's a perfect way to describe raw dough. Your butter timing probably messed with the gluten development too - brioche is already a pain to get right even when you follow the steps. Next time try adding the butter after you've got some decent gluten going, and maybe bump that temp up a bit since you're doing a loaf instead of buns","PriorImprovement8628",2025-10-28,2,t3_1ohx55o,1ohx55o
nlukbmv,"Here is what I do for the brine. If you’re doing fridge pickles and not actual canning, you don’t need to boil the brine unless you’re using powdered ingredients.//1:1 vinegar (minimum 5%) and water. You can change that ratio if it’s too vinegary for you. Add a tablespoon of salt for a quart jar. I don’t measure the seasonings but they can include dill weed or seed, mustard seed, garlic, chili flakes if you want heat.//I let them sit for at least three days before eating, that’s when they start to get a proper pickle flavor.","nifty-necromancer",2025-10-28,2,t3_1ohwgjo,1ohwgjo
nlrh8fm,"I haven’t made shelf stable pickles before, but lots of fridge pickles. I found that adding hot brine to the cucumbers kinda cooks them in the jar and I don’t love that, they get kinda soft. (Although I have seen grape leaf added which supposedly helps maintain the crunch, and you mentioned alum serves that purpose too?) I’ve actually had good success packing the jar with cucumbers, adding the vinegar, water, dill, garlic, salt, (pepper corns, mustard seed, grape leaf, etc) and shaking it up until the salt is dissolved. No boiling, no heat required. Once the salt is dissolved after shaking I keep them in the fridge as long as I can wait, 5-7+ days. Unfortunately I never write down the ratios so they never come out the same way twice, but they’ve never been inedible!","fleasnavidad",2025-10-28,1,t3_1ohwgjo,1ohwgjo
nltbqpk,"We had a huge garden when I was growing up, and my mom would make the best dill pickles.  It was tough having to wait the 6 weeks to eat them.","Public_Road_6426",2025-10-28,1,t3_1ohwgjo,1ohwgjo
nlthnx6,"You can eat them now, but if you like them really sour let them wait. //I make refrigerator vinegar pickles all the time, without alum,  they are ready in 3-5 days.","SubstantialPressure3",2025-10-28,2,t1_nls58bn,1ohwgjo
nlr8c2b,"interesting! appreciate the info ive never heard of alum. it seems your pickle recipe seems good but if it was horrible at 4 weeks thats not a good sign. if they are supposed to be fermented you might not want a full seal.  all i know is fridge pickles (vinegar, garlic, keep sealed in fridge) or fermented pickles (salt/water brine, garlic, dont seal because fermentation makes gas bubbles)","wesleypaulwalker",2025-10-28,1,t1_nlr7ebb,1ohwgjo
nlt97r4,"Key West Pickles Pub","talkingtoawall710",2025-10-28,1,t1_nlsggv2,1ohvnsb
nlt96ry,"Key west Pickles Pub!","talkingtoawall710",2025-10-28,2,t1_nlrhgsa,1ohvnsb
nlqk5r3,"Looks amazing! That cheese combo sounds absolutely perfect - cheddar and gouda together is chef's kiss. The design on top is really clean too, especially for a first attempt at doing patterns","SoftlyExclusive",2025-10-27,2,t3_1ohtzy3,1ohtzy3
nlqnkb7,"Thank you so much, I appreciate the compliments! It turned out pretty yummy, my bf described it as a grilled cheese made into bread.","Any_Ad1923",2025-10-27,1,t1_nlqk5r3,1ohtzy3
nlr0qxv,"Ive never been one to make pickles...I've always been afraid to try lol I don't wanna mess up. finally I tried on like Sept 19th I think and it says leave them for 6 to 8 weeks. Halloween is 8 weeks and I'm so nervous to open them. what was the recipe for yours?","krissibabyxo",2025-10-28,2,t3_1ohtv8h,1ohtv8h
nlr8u60,"I have been alternating between these two recipes https://www.thewardrobeconsultant.com/recipes/crisp-new-pickles and/https://agardenerstable.com/east-coast-new-pickles/.","partycurl",2025-10-28,1,t1_nlr0qxv,1ohtv8h
nlr8dqm,"I realized I completely forgot to mention what type I made. I made 48 hour briney refrigerator pickles cucumber, salt and spices only.  I have crisper but I didn't need to use it, I got fresh cucumbers and they stayed crisp.","partycurl",2025-10-28,1,t1_nlqpfu4,1ohtv8h
nlrfowa,"I prefer the taste to the ones I made where I boiled the water and added vinegar. I also dislike most store brand fresh pickles. I'm super picky. You will have to post when you use these recipes!","partycurl",2025-10-28,1,t1_nlrb67a,1ohtv8h
nlrg7u5,"I honestly love most pickles. I can eat a Mt olive one week. the next week eat claussens...then the next week fermented... lol the only ones I don't eat is sweet / bread and butter!","krissibabyxo",2025-10-28,1,t1_nlrfowa,1ohtv8h
nltl5n4,"Cornbread is one of the easiest things to make with a few ingredients. Like I think it was one of the first things my kids made on their own.///Starting with a mix is totally fine. Or look up a recipe (King Arthur is great!), get the stuff from the store, mix, bake, and enjoy delicious cornbread. ///You'll have cornmeal and eggs left over, so you can make more, maybe add a finely chopped jalapeno and some cheese, or whatever you like. ","starflower42",2025-10-28,1,t3_1ohtiyk,1ohtiyk
nlq19w0,"Dude that looks incredible for loaf #5! The crust looks perfect and you nailed that ear //  /Dutch oven method is game changing isn't it? Once you get comfortable with that recipe definitely try adding some mix-ins like herbs or cheese - takes it to the next level","correlationlone",2025-10-27,-38,t3_1ohri7y,1ohri7y
nlpximm,"Cream cheese. Mascarpone is a type of cream cheese","Ordinary-Finger-8595",2025-10-27,25,t3_1ohr4aj,1ohr4aj
nlpyqam,"Some midwestern recipies call for cream cheese in the ""bechamel"" mix, which I think is a reasonable substitute. The slight tang is always welcome.","zk3033",2025-10-27,7,t3_1ohr4aj,1ohr4aj
nls3obi,"You can swap mascarpone with cream cheese or a bit of heavy cream and it’ll stay creamy and rich","SpicyNaty",2025-10-28,3,t3_1ohr4aj,1ohr4aj
nls8ny0,"Double the recipe and use half an 8oz tub. Then throw the unused tub in the freezer until next time you make the Mac n cheese.","chefybpoodling",2025-10-28,2,t3_1ohr4aj,1ohr4aj
nlqc2cm,"Get an 8oz tub of it and make the Mac and cheese. //Then make tiramisù with the rest. Problem solved no substitute needed.","BostonFartMachine",2025-10-27,2,t3_1ohr4aj,1ohr4aj
nlpxpdj,"Combine what the other people said, u see e cream cheese with a splash of heavy cream","bigfoot17",2025-10-27,1,t3_1ohr4aj,1ohr4aj
nlv6cjq,"Not sure what 20g of Mascarpone could change in a recipe though 😅///I would have substituted with sour cream as I always have that around if I didn't have cream cheese handy. ","ovizii",2025-10-28,1,t3_1ohr4aj,1ohr4aj
nlqmibs,"Heavy cream, a bit of creamcheese and a knob of butter.","morticia_dumbledork",2025-10-27,1,t3_1ohr4aj,1ohr4aj
nlq6ct6,"I would just use heavy cream. Someone else mentioned cream cheese, which has a sour tang. The tang might not be discernable with all of the other ingredients in your M&C, though.//I'd say plain heavy cream has a closer flavor and has high fat content, like mascarpone.","Gut_Reactions",2025-10-27,-1,t3_1ohr4aj,1ohr4aj
nlqmevc,"Oddly enough I recently bought a more than I needed thinking I’d make more tiramisu than I did and ended up having extra mascarpone to use up. I used a spoonful here and there to mount into pan sauces or pasta sauces, as I might butter or crème fraiche.  I ran out of cream cheese for my morning bagel and used it instead and drizzled honey over it and was pleasantly surprised.","BostonFartMachine",2025-10-27,1,t1_nlqlqzu,1ohr4aj
nlpkafz,"Suddenly I'm craving a cheesesteak","Force321X",2025-10-27,5,t3_1ohp8d4,1ohp8d4
nlq8iyy,"I love rolling my baguettes in Sesame seeds. These are incredible looking, you really knocked it out the park here. Wow!","Dependent_Stop_3121",2025-10-27,1,t3_1ohp8d4,1ohp8d4
nlpil7c,"Those look solid! The seeded one is calling my name - there's something about those sesame seeds that just hits different on sourdough","Wild-Acanthisitta742",2025-10-27,0,t3_1ohp8d4,1ohp8d4
nlpkilj,"I love making cheesesteaks. Sadly, since moving from PA to SoCal I can’t get the right cheese (Cooper Sharp).","TurrettiniPizza",2025-10-27,6,t1_nlpkafz,1ohp8d4
nlprcvt,"South East PA myself! https://coopercheese.com/pages/buy-online I think you can have it delivered directly from their website. I don't know if there are any restrictions or extra fees for distance.","Force321X",2025-10-27,3,t1_nlpkilj,1ohp8d4
nlqrb9f,"Wegmans carries Cooper cheeses in the deli. Just in Case a Wegmans is near you.","Sean_man_87",2025-10-28,1,t1_nlpkilj,1ohp8d4
nlp66hp,"Yes, looks like perfect for Philly cheese steak!","Sharp-Ad-9221",2025-10-27,2,t3_1ohng6q,1ohng6q
nlp2wg8,"upon further inspection, this appears to be topped with custard and guava (?), \*not\* nacho cheese and pickle as I initially feared","fontinalis",2025-10-27,50,t3_1ohmr8a,1ohmr8a
nlpz6a1,"is that cheese sauce and a pickle?","HamBroth",2025-10-27,2,t3_1ohmr8a,1ohmr8a
nlpfecm,"I didn't even think that this can look as if it had nacho cheese and a pickle but I keep getting messages from my friend asking if I put a slice cucumber on it. Damn xD Yeah, so I made vanilla custard and that's a pear slice there, indeed. Nothing else, haha.","Fairy2play",2025-10-27,21,t1_nlp2wg8,1ohmr8a
nlpwftf,"That will work, I’d maybe add a couple tbsp of butter to offset the leanness of the meat. I personally add a little flour to thicken the gravy but that’s optional.","Bobaximus",2025-10-27,3,t3_1ohls0t,1ohls0t
nlouaz8,"What exactly are you asking? haha. Of course you can swap one red meat for another. Are you more asking for what flavors typically lend themselves more to bison? //You don't need to change anything though, unless you want to. There is no ""should"" though","WillowandWisk",2025-10-27,-3,t3_1ohls0t,1ohls0t
nloxgjd,"That's a good idea. I've made chicken broth before, but I've never tried doing so with another meat. Should I use a bone-in roast or something else?","Maker-of-the-Things",2025-10-27,1,t1_nlox1wd,1ohls0t
nlozy20,"We have quite a bit. Several roasts, 4 packages of stew meat (havent weighted them), and some steaks. I'll see what I can find online. Thank you!","Maker-of-the-Things",2025-10-27,2,t1_nloz5os,1ohls0t
nlp697k,"You won't have a problem with chicken, vegetable or beef broth overpowering the bison. You are fine to use your normal packaged broth. All will work with the flavor profile in this recipe using Bison. Though Bison does have a slightly different flavor than beef, it is similar enough that it can be interchanged with beef in almost any recipe.//Source: Have cooked Bison, antelope, venison, elk, and bear. I don't really recommend the bear for normal cooking methods. The biggest issue with any of them is that they tend to have less fat than farmed beef. Most of the time I am adding fat in some way when using game meats. //Farmed Bison should have more fat than most meats since most bison is also farmed and fed with grains. I would make your recipe as if using beef the first time. If the meat gets dry and tough during simmering/baking then you need to find a way to add some fat in next time. You could add fats by using ground beef along with the chunk bison, adding in pork belly, or even adding in uncooked bacon. If you use a simmer stage before putting everything in your pie shell you can remove the bacon after simmering. Otherwise, chop it into small pieces and put it in the pie with the bison. //I've also had some success by coating game meats in olive oil and searing them on high heat to seal them before putting in the pie or in the pot to simmer. In this case I'd guess at least some of that flour is going on the meat and the meat is getting seared. Oil is a fine line in this situation. Some oil helps it stick. Too much keeps the flour separated from the meat and it falls apart. If you have issues with the recipe working on the first try my guess is going to be this is the step you need to play with.","Kyrlen",2025-10-27,5,t1_nlozy20,1ohls0t
nlpbeu7,"I've made this recipe before (using beef) and it was delicious. //The bison is grass fed and finished, so I don't know how much grain it got during its lifetime (i know that grass fed and finished doesnt mean it never got grain). it does tend to be quite lean. I was planning to render the ground pork fat we got from the hog we bought earlier in the year.. im assuming that would be good to use to add fat to the meat? I believe the recipe suggests adding the flour to the sautéed vegetables, stirring in the broth, then adding the meat after.","Maker-of-the-Things",2025-10-27,1,t1_nlp697k,1ohls0t
nlpkzel,"I would honestly make the recipe as is the first time substituting the bison and adjust from there the next time you make it. Worst case scenario making it as is is the meat gets dry and chewy instead of tender. It will still be perfectly tasty and edible.","Kyrlen",2025-10-27,2,t1_nlpbeu7,1ohls0t
nlrm1lv,"But a meat thermometer and stop using timings given by recipes.  it's the only way to get good, consistent results with meat since by nature every piece is different in size and shape ","Great68",2025-10-28,1,t3_1ohi9mm,1ohi9mm
nlpk2a7,"Subway scares be, because… that meat 100% includes Hep C.","20thCenturyRefugee",2025-10-27,4,t3_1ohicxj,1ohicxj
nlnvoi3,"I use them if I have a good soft cheese spread on hand. I will toast them up in the oven and put the cheese spread on it.  Makes for a good snack.","PaganQueenNaturally",2025-10-27,3,t3_1ohh5km,1ohh5km
nlqkdun,"My family knows to save the heels for me of any type of homemade/artisan bread. Store bought squishy bread? We rarely buy it, but those heels are flipped and made into grilled cheese sandwiches.b","iknowyouneedahugRN",2025-10-27,3,t3_1ohh5km,1ohh5km
nloacyy,"I also like the heels of the loaf but for those who don't, they make a fine grilled cheese sandwich. Turn the crusty side to the inside of the sandwich and make as usual. By the time the grilling is done you won't be able to tell that it was made from the heels. The inside becomes soft and indistinguishable from a regular sandwich.","spreal",2025-10-27,1,t3_1ohh5km,1ohh5km
nlod1nb,"Bread heals are the best for holding weighty amounts of avocado. A toasted heal, half an avocado, sesame seeds, some flaky salt…<drool>","Steel_Rail_Blues",2025-10-27,1,t3_1ohh5km,1ohh5km
nlpiiya,"I put the heel end on the inside of a grilled cheese sandwich. Or I throw it in my bread scrap bag in the freezer for stuffing for a turkey.","DensHag",2025-10-27,1,t3_1ohh5km,1ohh5km
nlrxx8b,"If it's cut thick enough I have no preference. I don't see the difference between that and hamburger buns, hot dog buns, sub sandwiches etc. But if it's good bread like sourdough I'm 100% going for the ends","Averagebaddad",2025-10-28,1,t3_1ohh5km,1ohh5km
nlve6s6,"These make better hotdog buns than actual hotdog buns. //I will die on this hill and take you with me.","Superlite47",2025-10-28,1,t3_1ohh5km,1ohh5km
nlw3l7g,"I just call it the crust and I like it, especially for cheese on toast.","Suspicious_Banana255",2025-10-28,1,t3_1ohh5km,1ohh5km
nlnwvcl,"Completely agree! I no longer eat meat but the end cap slice was the only piece of a beef roast I’d eat when I was a kid.","Fyonella",2025-10-27,5,t1_nlnvohp,1ohh5km
nlw1kr2,"Just flip it over so the crusty side is inside the sandwich and make a grilled cheese. You'll never notice it and it doesn't get thrown away.","CyberDonSystems",2025-10-28,1,t1_nlo5csc,1ohh5km
nlny81i,"I think if I were doing it I'd use ground breakfast sausage, break it up and brown it in a frying pan.  Just after dimpling the focaccia I'd sprinkle that over the top, crack a suitable number of eggs on top (maybe try to make cavities to hold them,) then sprinkle the whole thing with cheese before it goes in.//And maybe try to bake it at a slightly lower temp for longer to avoid burning toppings.","win_awards",2025-10-27,1,t3_1ohgrvd,1ohgrvd
nlod0va,"I'm not sure how well focaccia would hold inclusions but if you're worried you could sprinkle the sausage on before dimpling it and push it down into the dough.  Some topping loss is inevitable, but between that and the cheese I don't think you'd lose much.//eta: Forgot to mention, I could offer you my focaccia recipe, but I use a starter so if you're using store-bought yeast you'd have to modify it somewhat.  Probably better to try King Arthur's.","win_awards",2025-10-27,1,t1_nlo8f78,1ohgrvd
nlnjmiu,"It’s coming I promise 😭😂/Give me an hour or at least 30 mins so it doesn’t pill up with the knife. The satin texture makes me think it’s gonna be a nice, strong crumb. //I will be eating this as soon as possible for it to stay good, as I have been up literally all night tending to the dough. My stomach is ready for it. And it smells like cheese-its (the perfect level of sour and lactic acid flavors)","GrayDawg23",2025-10-27,1,t1_nlnitxu,1ohfcga
nlo2ogu,"Thank you! I put cheese on the top too for the last 10 mins of baking - deffo recommend 🤤","ReynartTheFox",2025-10-27,2,t1_nlngn3o,1ohfbj9
nlnvn41,"- savoury strata or casserole dish. chop it up and mix it with some eggs, milk, veggies, meat, cheese, seasonings, pour into a large dish and bake /- toast and pulse in a blender to make breadcrumbs to use as a topping (for pasta, soup, salad) or a breading coating (for fried chicken, mozzarella sticks, tempura) or a binder (for meatballs, meatloaf, dumplings)","ruinsofsilver",2025-10-27,1,t3_1ohf4hi,1ohf4hi
nlu5gfs,"French toast!  Buns make good French toast, just cut off the top and bottom crusts.","spkoller2",2025-10-28,1,t3_1ohf4hi,1ohf4hi
nlxbs8f,"If you have the freezer space, make a filling of shredded cheese, browned Italian sausage, marinara sauce, sliced pepperoni. Slice the buns leaving a hinge and scoop out some of the bread inside - add that to the filling. Fill each roll/shell, wrap individually in foil, freeze. Whenever you want one, heat it in the oven and voila. Pizza subs. (From Good Cheap Eats).","Belfry9663",2025-10-29,1,t3_1ohf4hi,1ohf4hi
nlnv9x4,"To cook? I used a large frying pan with relative high sides. /If you plan to make other things with pretzel dough look up Laugenkonfekt. They’re like pretzel bites, maybe a bit bigger and rolled in different toppings (sesame, poppy seed, sunflower and pumpkin seeds) before baking. A very delicious snack.","frankenstein-victor",2025-10-27,3,t1_nlnqxfc,1ohez4b
nlovpvd,"Yeah but it was the most complicated way to adopt from the CDS. I had to wait 5 months for her to come to Germany (rabies vaccine, test, 3 month wait period due to EU regulations, and finally a flight parent that took her home). Worth it though. //I've been to Hamburg once as a kid. Long time ago hehe. //Spundekäs is great and very easy to make. There are variations and everyone has their preferences for what kinds of dairy to use - most people use Magerquark, Schmand and cream cheese. Then sweet and spicy paprika powder, salt, black pepper, optionally garlic, and optionally very finely chopped onions. Though some people cut them in rings and place them on top. That's it. Done in like 5 minutes and delicious with Laugengebäck. Or bread sticks, tortilla chips etc.","Rhiannon1307",2025-10-27,2,t1_nlosz11,1ohez4b
nln5654,"Thank you so much 😊 We used up the leftover roast chicken and stuffing from yesterday’s Sunday lunch 😋 //Yeah a cold kitchen is my problem too. Although it was a bit expensive, I bought this one and it’s been the absolute best thing! So easy to set up and put away. I’ve made baguettes, cinnamon buns and hot cross buns so far 👍 //https://www.lakeland.co.uk/63493/brod-and-taylor-folding-bread-proofer-and-slow-cooker-fp-205?utm_source=google&utm_medium=cpc&gad_source=1&gad_campaignid=20891625552&gbraid=0AAAAADtoD6M8bJOTA4SfTaMoZNsMiMe4u&gclid=Cj0KCQjwsPzHBhDCARIsALlWNG0MAYzSJWA_HeK06BHrdSBzifXEm6Fs9_AZObGWc7BK7QFz2mIw-lwaAi1lEALw_wcB","Jazzietunes",2025-10-27,1,t1_nln3qsi,1ohdg31
nln4tfq,"The other Chinese method, sometimes used in combination with cooking alcohol, is to blanch the meat briefly to remove the gamey smell.","langoustine",2025-10-27,3,t1_nln07eo,1ohce57
nlqk0il,"That is a very very good loaf to start with.  Goodness gracious...my first loaf looks like meatloaf compared to this.  Well done.","rolandboard",2025-10-27,3,t3_1oh9sn6,1oh9sn6
nlsrenu,"The Dead Meat podcast has a few different creepypasta episodes, plus a ton of other similar content if you're looking for more horror centric content.//James and Chelsea do awesome research on pretty much all the topics they talk about, too.","AwesomeMcPants",2025-10-28,1,t3_1oh5jlv,1oh5jlv
